|Address|Category|Name|Subcategory
199|Sanayi Mh.Şehit Org.Eşref -Sanayi Mh.Şehit Org.Eşref, Turkey|Clothes|SURMELI TRIKO KONF. TURIZM SAN.TIC.LTD.|Athletic Apparel
200|Kerestecıler Sıtesı Gülseven Sok. No20/A Merter Ist., Turkey|Clothes|STIL TRIKO A.S.|Athletic Apparel
201|İstanbul Evleri Çayır Sk. No:11/B Bahçelievler İstanbul, Turkey|Clothes|STEP REKLAM VE TANITIM HZIMETLERI SAN. TIC. LTD. STI.|Athletic Apparel
202|D.Pasa Cd. M.Efendi Sk. Topkapı İstanbul, Turkey|Clothes|SELTEKS TEKSTIL GIYIM SAN VE TIC A.S.|Athletic Apparel
203|Camlik Cad.No.3,Oto Sanayi 4.Levent 80660/Istanbul, Turkey|Clothes|SAVEKS TEKSTIL SANAYI VE TICARET A.S.|Athletic Apparel
204|Mahmutbey Mah. Hacı Bostan Cad. Conat Sok. No: 3 Bağcılar - İstanbul, Turkey|Clothes|CIPO & BAXX YIL-BA TEKSTIL SAN. VE TIC. LTD. STI.|Athletic Apparel
205|İncilipınar Mahallesi 4 Nolu Cadde Yüncüler İş Mrk Kat 3 No 73 Şehitkamil Gaziantep, Turkey|Clothes|FEYZ YAPI INSAAT MUHENDISLIK IC VE DIS TICARET LTD STI|Athletic Apparel
206|Keresteciler Sitesi, Fatih Cd., Mese Sk.,No:1/6, Kahyalar İsm., Merter  İstanbul, Turkey|Clothes|KOZA TRIKO ORME SAN. TIC. LTD. STI.|Athletic Apparel
207|Ağaçişleri Sn:Başkışla Sk:No:23, Turkey|Clothes|PANELRAF|Athletic Apparel
208|Ulukent Tekstil & Promosyon H.Kaplanlar Mh. Barış Cad. No:25, Turkey|Clothes|ULUKENT TEKSTIL PROMOSYON|Athletic Apparel
209|Sucuzade Mahallesi Soydan Caddesi Yalpa İşhanı Kat: 1 No: 103 Seyhan - Adana, Turkey|Clothes|CARMIN TEKSTIL|Athletic Apparel
210|Fatih Cad. Ladin Sok No:6/5 Merter-İst., Turkey|Clothes|GORSIN|Athletic Apparel
211|Fevzipaşa Caddesi 47/3 Küçükbakkalköy-Ataşehir-İ, Turkey|Clothes|MEGASTAR AJANS IC VE DIS TICARET LTD.STI|Athletic Apparel
212|Fevzi Çakmak Mah., 10638 Sk., No: 3/1 Blok No: 7/B06, Karatay, Konya, Turkey|Clothes|SEVENSAND TEXTILE|Athletic Clothing
213|Çobançeşme Mah., Sanayi Cad., No: 78, Yenibosna, Bahçelievler, İstanbul, Turkey|Clothes|TOP CLOTHINGS SENKO|Athletic Clothing
214|Yeni Mah., Oba Sk., No: 8, Karahallı, Uşak, Turkey|Clothes|ERCANSOY TEKSTIL MOB. GIDA SAN. VE TIC. LTD. STI.|Athletic Clothing
215|Fulya Mah., Ortaklar Cad., Gündoğdu Apt. No: 8 D: 3, Mecidiyeköy, Şişli, İstanbul, Turkey|Clothes|ND MODA SAN. VE TIC. LTD. STI.|Athletic Clothing
216|Gaziosmanpaşa Bulvarı, Kızılırmak İş Merkezi, No: 58/503, Çankaya, İzmir, Turkey|Clothes|MAYYANA TEKSTIL SAN. TIC. LTD. STI.|Athletic Clothing
217|Hamidiye Mah., Söyler Cad., No: 4, Kat: 5-6, Kağıthane, İstanbul, Turkey|Clothes|DORAMODA TEKSTIL SAN. VE DIS TIC. LTD. STI.|Athletic Clothing
218|İkitelli Org. San. Böl., Giy. San. Koop., 3 Ada B Blok, Kat: 1 No: 114, 34670 İkitelli, İstanbul, Türkiye|Clothes|LEVIN TEKSTIL VE OTOMASYON SAN. VE TIC. LTD. STI.|Athletic Clothing
219|Didenur Sok., No: 8, Seyrantepe, İstanbul, Turkey|Clothes|SALKIM TEKSTIL SAN. TIC. LTD. STI.|Athletic Clothing
220|Dere Sok., 15/1, Osmanbey, İstanbul, Turkey|Clothes|MILONO CLUB|Athletic Clothing
221|Yüzyıl Mah., Otocenter P/Blok, No: 52, Bağcılar, İstanbul, Türkiye|Clothes|NTK GIYIM|Athletic Clothing
222|DUAÇINARI MAH., VİŞNE CAD. NO 144/Z1, YILDIRIM, BURSA, TÜRKİYE|Clothes|FATIHIM TEKSTIL KONFEKSIYON INSAAT GIDA SAN. VE TIC. A.S.|Athletic Clothing
223|Çirişhane Mah Kanalboyu Caddesi 3.Söğüt Sok No:2/2 Osmangazi, Bursa|Clothes|ORSE TEKSTIL KONFEKSIYON GIDA PAZ SAN TIC LTD STI|Athletic Clothing
224|Duaçınarı M Yeşilova C. No 37 Yıldırım BURSA|Clothes|SAM BUSINESS TRADIN COMPANY/SAMBIZ IC VE DIS TICARET|Athletic Clothing
225|Talatpaşa mahallesi aslangazi caddesi no 15/2 kağıthane/Istanbul|Clothes|SBT EXPORT&IMPORT|Athletic Clothing
226|Kartal Sokak, No: 1/1A, Icerenkoy, Atasehir, Istanbul, Turkey|Clothes|MY MOTOSIKLET|Athletic Clothing
227|Cebeci Mah., Eski Edirne Asfalti, No: 726, Kat: 2, Sultanciftligi, Istanbul, Turkey|Clothes|DSM TEKSTIL|Athletic Clothing
228|M. Nezih Ozmen Mah., Cinar Sokak, Efendioglu Is Merkezi, No: 22, Kat: 4, Istanbul, Turkey|Clothes|JFREE TEKSTIL|Athletic Clothing
229|Duacinari Mh., Visne Cd., No: 120/2, Yildirim, Bursa, Turkey|Clothes|BEBUTIK|Athletic Clothing
230|Zafer Mah., Ahmet Yesevi Cad., Yuksel Sokak., Gokce Is Merkezi, No: 36/2, Yenibosna, Bahcelievler, Istanbul, Turkey|Clothes|JOLLY TEKSTIL SAN. TIC. LTD. STI.|Athletic Clothing
231|Litros Yolu, Yol Sok., No: 1, Kat: 2, Topkapi, Istanbul, Turkey|Clothes|LINEA GIYIM SAN. VE TIC. LTD. STI.|Athletic Clothing
232|Mahmut Sevket Pasa Mah., Sahinkaya Sok., No: 13, Azim Plaza, Okmeydani, Sisli, Istanbul, Turkey|Clothes|ETU TEKSTIL SAN. VE DIS TIC. LTD. STI.|Athletic Clothing
233|Fabrikalar Cad. No : 62/A Gumusler - Denizli|Clothes|MER TEKSTIL|Athletic Clothing
234|Perpa Ticaret Merkezi, B Blok, Yesil Avlu, Kat: 2, No: 35, Okmeydani, Sisli, Istanbul, Turkey|Clothes|EURO PROTECTION|Athletic Clothing
235|Kavacik Mah., Sehit Tegmen Ali Yılmaz Sok., No: 15, Beykoz, Istanbul, Turkey|Clothes|RUNTEK MAGAZACILIK TEKSTIL VE TIC. A. S.|Athletic Clothing
236|Bağlar mah Osmanpaşa Cad. No-55 Güneşli - İST|Clothes|SELTA GRUP LTD STI|Athletic Clothing
237|Mahmutbey Mah. Narlı Sok. No:4|Clothes|REFORM SPOR SISTEMLERI VE INSAAT SAN. TIC. LTD. STI.|Athletic Clothing
238|Kocaoglan Mahallesi Demokrasi Bulvari No:41 27100 Sahinbey Gaziantep Turkiye|Clothes|BURAK DIS TICARET|Athletic Clothing
239|Demirtas Dumlupinar Mahallesi, 51. Sokak, No: 14/1, Osmangazi, Turkey|Clothes|FIBRA WORLD TEXTILE|Athletic Clothing
240|Barakfakih Mahallesi 17. Cadde no:7 Kestel/BURSA|Clothes|UNS TEKSTIL SAN. VE TIC. LTD. STI. |Athletic Clothing
241|sarımeşe mh bağdat yolu cd no:23/b  kartepe kocaeli|Clothes|JAGUAR GIDA TURIZM TEKSTIL SAN.TIC.LTD.STI.|Athletic Clothing
242|Çobançeşme Mah., Sanayi Cad., No: 78, Yenibosna, Bahçelievler, İstanbul, Turkey|Clothes|SENKO TEKSTIL SAN. VE TIC. A.S.|Athletic Wear
243|Şairginar Sok., No: 71, Osmanbey, İstanbul, Turkey|Clothes|RENGIN GIYIM SAN. VE TIC. LTD. STI.|Athletic Wear
244|Gaziosmanpaşa Bulvarı, Kızılırmak İş Merkezi, No: 58/503, Çankaya, İzmir, Turkey|Clothes|MAYYANA TEKSTIL SAN. TIC. LTD. STI.|Athletic Wear
245|Hamidiye Mah., Söyler Cad., No: 4, Kat: 5-6, Kağıthane, İstanbul, Turkey|Clothes|DORAMODA TEKSTIL SAN. VE DIS TIC. LTD. STI.|Athletic Wear
246|İkitelli Org. San. Böl., Giy. San. Koop., 3 Ada B Blok, Kat: 1 No: 114, 34670 İkitelli, İstanbul, Türkiye|Clothes|LEVIN TEKSTIL VE OTOMASYON SAN. VE TIC. LTD. STI.|Athletic Wear
247|Fulya Mah., Ortaklar Cad., Gündoğdu Apt. No: 8 D: 3, Mecidiyeköy, Şişli, İstanbul, Turkey|Clothes|ND MODA SAN. VE TIC. LTD. STI.|Athletic Wear
248|Didenur Sok., No: 8, Seyrantepe, İstanbul, Turkey|Clothes|SALKIM TEKSTIL SAN. TIC. LTD. STI.|Athletic Wear
249|Dere Sok., 15/1, Osmanbey, İstanbul, Turkey|Clothes|MILONO CLUB|Athletic Wear
250|Çobançeşme / Yenibosna / İstanbul / Turkey|Clothes|ORAT ORME DIS TICARET LTD.STI|Athletic Wear
251|Abdulkadir Gurman Mah,Ahmet Kutsi Tecer Cad,Altay Sokak.No:5 Dukkan 5D Merter/Istanbul, Turkey|Clothes|MINISTAR KIDS WEAR|Athletic Wear
252|Selamet Mahallesi Kaymak Sokak No:50 Osmangazi, Bursa, Turkey|Clothes|DIKELLER LTD.STI|Athletic Wear
253|Sanayi Mh. Adem Yavuz sk. no:18-20B kat:1 Gungoren/İstanbul Turkiye|Clothes|FORTY SEVEN|Athletic Wear
254|Ali Osman Sönmez Cd. No:32 16260 Dosab - Bursa, Turkey|Clothes|MARSTEKS DOSEMELIK KUMAS DOKUMA TEKSTIL KONFEKSIYON SAN. TIC. LTD. STI.|Athletic Wear
255|Batı Mah. Akasya Sk. No: 18/B Pendik - İstanbul, Turkey|Clothes|BEBEKS BEBEK URUNLERI|Athletic Wear
256|Merkez Mah. Ziya Gökalp Cad. 27  Güngören-İstanbul   Turkey|Clothes|OZBILICILER TEKSTIL LTD.|Athletic Wear
257|Hirka-i Serif Mah- Arpa Emini Koprusu Sok 13/21 - Fatih-Istanbul   , Turkey|Clothes|SHAMSALAM|Athletic Wear
258|Giyimkent Sitesi Oruç Reis Mah. Vadi Cad. No:134 Esenler / İstanbul / Turkey|Clothes|TAMA TEKSTIL SAN. VE DIS TIC. A.S|Athletic Wear
259|Hoybar Mah. Ankara Cad. Uygun Han No: 41 Kat: 2 Fatih - İstanbul, Turkey|Clothes|IHTIYACLARIM BURADA BILISIM IC VE DIS TIC. LTD. STI.|Athletic Wear
260|İstanbul, Turkey|Clothes|34 TEXTILE AGENCY|Athletic Wear
261|Kartal/İstanbul, Turkey|Clothes|MUST&COSH|Athletic Wear
262|Fatih Mh. Atatürk Cd. Övgü Sk. No.20.A Sultanbeyli, Turkey|Clothes|TURKUVAZ GIYIM|Athletic Wear
263|Yarımburgaz Mah. Istanbul Cad. No:102 Küçükçekmece Istanbul, Turkey|Clothes|BETEKS TEKSTIL TIC. VE SAN. LTD. STI.|Athletic Wear
264|M. Mazharbey Cad. Sevük Sk. No: 7/15 Göztepe - İstanbul, Turkey|Clothes|MAHINUR BILGEN BABY WEAR AND ACCESSORIES|Athletic Wear
265|Turkey / İstanbul|Clothes|SRK CLOTHING|Athletic Wear
266|Selamiali Mah. Cumhuriyet Cad. Boğaziçi Plaza  No:46 K:5 Üsküdar Istanbul Turkey|Clothes|OKSARIT FOREIGN TRADE CO.LTD|Athletic Wear
267|Mehmet Nesih Özmen Mahallesi. Keresteciler Sitesi Kayalar Sokak. No:18-2 Merter/Güngören/Turkey|Clothes|CODECLOTHING|Athletic Wear
268|Turkey|Clothes|COZUM TEKSTIL|Athletic Wear
269|Merkez Efendi Mah1842 Sk No:45 Merkez/Denizli, Turkey|Clothes|SARKO EGE TEXTILE|Athletic Wear
