|Address|Category|Name|Subcategory
0|"Terazidere Mah., Güneş Cad., Sinan Sokak, No:7, 
Bayrampaşa, İstanbul, Turkey"|Clothes|CANTATURK|Accessories
1|Beylikdüzü Organize Sanayi Bölgesi, Mermerciler Sanayi Sitesi, Beylikdüzü, İstanbul, Turkey|Clothes|TEMA YAPI MALZEMELERI SAN. VE TIC. LTD. STI.|Accessories
2|Maltepe Mah., Dokumacılar Sitesi Sk., Hacıbey İş Hanı, No: 8/2, Zeytinburnu, İstanbul, Türkiye|Clothes|SAY STEEL INOX CONSTRUCTION PRODUCTS|Accessories
3|Cumhuriyet Mah., Yelken Sk., No:5, Çayırova, Kocaeli, Turkey|Clothes|LIDER DEKORATIF DEMIR URUNLERI NAK. INS. SAN. TIC. LTD. STI.|Accessories
4|Fevzi Çakmak Mah., 10638 Sk., No: 3/1 Blok No: 7/B06, Karatay, Konya, Turkey|Clothes|SEVENSAND TEXTILE|Accessories
5|Eyup Sultan Mah., Göreme Sok., No: 4, Sancaktepe, İstanbul, Turkey|Clothes|MEGAVIZYON ITH. IHR. VE PAZ. TIC. LTD. STI.|Accessories
6|Merkez Mah., Güzle İş Merkezi, Kat: 4, Çekmeköy, İstanbul, Turkey|Clothes|SONOROUS SES VE GORUNTU SISTEMLERI SAN. TIC. A.S.|Accessories
7|Yakuplu Mah., Hürriyet Bulvarı, No: 6, Beylikdüzü, İstanbul, Turkey|Clothes|CUHADAROGLU METAL SAN. VE PAZ. A.S.|Accessories
8|Kocatepe Mah., Lamartine Cad., No: 5, Lamartine Binası, Kat: 6, 34437 Taksim, İstanbul, Turkey|Clothes|AYGA METAL SAN. VE TIC. LTD. STI.|Accessories
9|Organize San. Böl., Kuddusi Cad., No: 30, Selçuklu, Konya, Turkey|Clothes|ALTIN BURO DAYANIKLI TUKETIM MALZEMELERI SAN. VE TIC. LTD. STI.|Accessories
10|Gürses Plaza Birlik Mh., M.Akif İnan Cad., No: 4, Atışalanı, Esenler, İstanbul, Turkey|Clothes|CUCINOX ELEKTIKLI MUT. ALET. SAN. VE TIC. A.S.|Accessories
11|Mehmet Akif Ersoy Mh. Yayladami sk. NO:1/3 Kağıthane/İST|Clothes|VESSI TEKSTIL SAN. VE TIC. LTD. STI.|Accessories
12|29 Ekim Mah., 9216 Sok., No:10, Yazıbaşı, Torbalı, İzmir, Turkey|Clothes|BUKER MAKINA LTD. STI. BUKER PVC |Accessories
13|Elazığ Karayolu Organize Sanayi Bölgesi, 17. Cadde, No:8, Diyarbakır, Turkey|Clothes|KARAVIL DIS TICARET A.S |Accessories
14|Organize Sanayi Bölgesi, 43. Cad., No: 8, Melikgazi, Kayseri, Turkey|Clothes|HUZUR HIRDAVAT TICARET PAZARLAMA SAN. VE TIC. LTD. STI.|Accessories
15|Akçaburgaz Mah., 3073 Sk., No: 4/3, Esenyurt, İstanbul, Turkey|Clothes|DEPPOT BANYO EKIPMANLARI SAN. TIC. A.S.|Accessories
16|Organize San. Böl., 1. Kısım, Merkez, Tokat, Turkey|Clothes|HAS OZGEN TEKSTIL SAN. VE TIC. A.S.|Accessories
17|Organize Sanayi Bölgesi, 30. Cad., No: 24/B, Kayseri, Turkey|Clothes|SUNPA ORMAN URUNLERI ITHALAT IHRACAT SAN. TIC. LTD. STI.|Accessories
18|Turkey|Clothes|PVC DOOR WINDOW ACCESSORIES PLASTIC LTD.STI|Accessories
19|Şerif Ali Mah., Burhan Sk., No: 8/15, Ümraniye, İstanbul, Turkey|Clothes|SILA TEKSTIL SAN. VE TIC.|Accessories
20|İkitelli OSB Mah., Semt Aymakoop C2 Blok Sk. 1 1, Merkez Köyü Merkez Bucağı, Başakşehir, İstanbul, Turkey|Clothes|LEODE DERI VE SAN. TIC. LTD. STI.|Accessories
21|Atatürk Mah., 57 Ada, Manolya 319 D: 13, Ataşehir, İstanbul, Turkey|Clothes|PERPOLIO ITHALAT IHRACAT INSAAT GIDA TURIZM SAN. VE TIC. A.S.|Accessories
22|İnönü Mh. Gebze Plastikçiler Org. San. Böl. (Geposb) Balçık Yolu Atatürk Blv.11.Cd. No:4/2 Gebze/Kocaeli , Turkey|Clothes|YALVAC ALUMINYUM INS. SAN. VE TIC. LTD. STI.|Accessories
23|"Fulya Mah. Denizhan Sokak Konyalı Apt. No:12/A 34394, 
Mecidiyeköy, Şişli İstanbul	, Turkey"|Clothes|PROTRIM YAPI SISTEMLERI ANONIM SIRKETI|Accessories
24|Kalamış-Kadıköy, Turkey|Clothes|TETYANA ALP|Accessories
25|Yeni Mah. Galeri Cad. No. 36/A Gaziosmanpaşa İstanbul, Turkey|Clothes|OLGUN TEKSTIL|Accessories
26|Hadimkoy Mah., Istanbul, Turkey|Clothes|ALUMINIUMPARK|Accessories
27|B.O.S.B. Mermerciler Sanayi Sitesi, 8. Cadde, No:12/A Beylikdüzü - İstanbul Turkey|Clothes|ROZA PLASTIK|Accessories
28|Yeni Mahalle Cebeci Caddesi 542/1 Sokak No: 12 Küçükköy - Gaziosmanpaşa / İstanbul , Turkey|Clothes|NADIDE METAL|Accessories
29|Metal-İş San Sit. 17.Blok. No:33 34490 Ikıtellı O.S.B. Basaksehır-Istanbul Turkey|Clothes|FONTE AKSESUAR|Accessories
30|Namık Kemal Mah Orkıde Cad No: 16 Esenyurt-İstanbul, Turkey|Clothes|AS SPOR MALZEMELERI  SANAYI  VE TICARET LIMITED SIRKETI|Activewear
31|mesih pasa caddesi no:47  b Laleli /  Istanbul TURKEY|Clothes|SOCCER|Activewear
32|İncili Pınar Mah., Nişantaşı Sok., F.H İş Merkezi, No: 11, Kat: 2, D/1, Şehitkamil, Gaziantep, Turkey|Clothes|F&M SAN GIDA DIS TIC. LTD. STI.|Apparel
33|Çobançeşme Mah., Sanayi Cad., No: 78, Yenibosna, Bahçelievler, İstanbul, Turkey|Clothes|TOP CLOTHINGS SENKO|Apparel
34|Fulya Mah., Ortaklar Cad., Gündoğdu Apt. No: 8 D: 3, Mecidiyeköy, Şişli, İstanbul, Turkey|Clothes|ND MODA SAN. VE TIC. LTD. STI.|Apparel
35|Didenur Sok., No: 8, Seyrantepe, İstanbul, Turkey|Clothes|SALKIM TEKSTIL SAN. TIC. LTD. STI.|Apparel
36|Turkey|Clothes|ECE TUCTURE TEKSTIL URUNLERI HOME OFFICE MUSTERI TEMSILCISI|Apparel
37|Mahmutbey Mah. Hacı Bostan Cad. Conat Sok. No: 3 Bağcılar - İstanbul, Turkey|Clothes|YIL-BA TEKSTIL SAN. VE TIC. LTD. STI.|Apparel
38|"Ceyhun Atuf Kansu Caddesi Beycanoglu İs Mrkz No 104/O
Balgat/ Ankara/Turkey"|Clothes|ZAFINA TEKSTIL GIYIM SAN TIC LTD STI|Apparel
39|Keresteciler Sitesi Limon Sk. No.20 Merter/ İstanbul, Turkey|Clothes|YILMAZ TEKS.SAN.VE TIC.A.S.|Apparel
40|Tahtakale Cad. Çamaşırcılar Sok. No:12 34460 Istanbul, Turkey|Clothes|YAKUP MURAT VE ORT. KOLL. STI.|Apparel
41|B.Çekmece Hadımköy Bağlantı Yolu Üzeri No:55 İstanbul, Turkey|Clothes|VIPEKS TEKSTIL URUNLERI SANAYI VE PAZARLAMA A.S.|Apparel
42|Mithatpaşa Mah.Ardıç Sok. No22 Adapazarı/Turkey|Clothes|VELIOGLU TEKSTIL VE ESARP SAN.VE TIC.LTD.STI.|Apparel
43|10039 Sok. No:26 Ataturk Org. San.Böl. Çiğli-İzmir, Turkey|Clothes|UNITEKS GIDA TEKSTIL A.S|Apparel
44|Evren Mah.Gülbahar Cd.Tufan Sk-Evren Mah.Gülbahar Cd.Tufan Sk, Turkey|Clothes|TUTUNCULER TEKS.VE GIY.SAN.TIC|Apparel
45|Tomurcuk Sk İzmen St. B2 Bl. D90 Mecıdıyeköy İstanbul, Turkey|Clothes|TUREKS ITHALAT IHRACAT VE TICARET A.S.|Apparel
46|Beş Telsiz M. G-1 Sk. N.24/A Zeytinburnu İstanbul, Turkey|Clothes|TOPO TEKSTIL SAN. VE TIC. LTD. STI.|Apparel
47|Yıldırım Mah. Akgün Sok. No:12 Bayrampaşa, Turkey|Clothes|TEKSAS TEKSTIL SAN. VE TIC.LTD.STI.|Apparel
48|İnönü Cad. Hoşgör Sk No.3 80650 4.Levent Istanbul, Turkey|Clothes|TARS ULUSLARARASI DIS TICARET TURIZM VE SANAYI LTD.|Apparel
49|Sanayi Mh.Şehit Org.Eşref -Sanayi Mh.Şehit Org.Eşref, Turkey|Clothes|SURMELI TRIKO KONF. TURIZM SAN.TIC.LTD.|Apparel
50|Kerestecıler Sıtesı Gülseven Sok. No20/A Merter Ist., Turkey|Clothes|STIL TRIKO A.S.|Apparel
51|İstanbul Evleri Çayır Sk. No:11/B Bahçelievler İstanbul, Turkey|Clothes|STEP REKLAM VE TANITIM HZIMETLERI SAN. TIC. LTD. STI.|Apparel
52|D.Pasa Cd. M.Efendi Sk. Topkapı İstanbul, Turkey|Clothes|SELTEKS TEKSTIL GIYIM SAN VE TIC A.S.|Apparel
53|Camlik Cad.No.3,Oto Sanayi 4.Levent 80660/Istanbul, Turkey|Clothes|SAVEKS TEKSTIL SANAYI VE TICARET A.S.|Apparel
54|Mahmutbey Mah. Hacı Bostan Cad. Conat Sok. No: 3 Bağcılar - İstanbul, Turkey|Clothes|CIPO & BAXX YIL-BA TEKSTIL SAN. VE TIC. LTD. STI.|Apparel
55|İncilipınar Mahallesi 4 Nolu Cadde Yüncüler İş Mrk Kat 3 No 73 Şehitkamil Gaziantep, Turkey|Clothes|FEYZ YAPI INSAAT MUHENDISLIK IC VE DIS TICARET LTD STI|Apparel
56|Keresteciler Sitesi, Fatih Cd., Mese Sk.,No:1/6, Kahyalar İsm., Merter  İstanbul, Turkey|Clothes|KOZA TRIKO ORME SAN. TIC. LTD. STI.|Apparel
57|Ağaçişleri Sn:Başkışla Sk:No:23, Turkey|Clothes|PANELRAF|Apparel
58|Ulukent Tekstil & Promosyon H.Kaplanlar Mh. Barış Cad. No:25, Turkey|Clothes|ULUKENT TEKSTIL PROMOSYON|Apparel
59|Sucuzade Mahallesi Soydan Caddesi Yalpa İşhanı Kat: 1 No: 103 Seyhan - Adana, Turkey|Clothes|CARMIN TEKSTIL|Apparel
60|Fatih Cad. Ladin Sok No:6/5 Merter-İst., Turkey|Clothes|GORSIN|Apparel
61|Fevzipaşa Caddesi 47/3 Küçükbakkalköy-Ataşehir-İ, Turkey|Clothes|MEGASTAR AJANS IC VE DIS TICARET LTD.STI|Apparel
62|İncili Pınar Mah., Nişantaşı Sok., F.H İş Merkezi, No: 11, Kat: 2, D/1, Şehitkamil, Gaziantep, Turkey|Clothes|F&M SAN GIDA DIS TIC. LTD. STI.|Apparel Clothing
63|Yeni Mah., Oba Sk., No: 8, Karahallı, Uşak, Turkey|Clothes|ERCANSOY TEKSTIL MOB. GIDA SAN. VE TIC. LTD. STI.|Apparel Clothing
64|Fevzi Çakmak Mah., 10638 Sk., No: 3/1 Blok No: 7/B06, Karatay, Konya, Turkey|Clothes|SEVENSAND TEXTILE|Apparel Clothing
65|Çobançeşme Mah., Sanayi Cad., No: 78, Yenibosna, Bahçelievler, İstanbul, Turkey|Clothes|TOP CLOTHINGS SENKO|Apparel Clothing
66|Fulya Mah., Ortaklar Cad., Gündoğdu Apt. No: 8 D: 3, Mecidiyeköy, Şişli, İstanbul, Turkey|Clothes|ND MODA SAN. VE TIC. LTD. STI.|Apparel Clothing
67|İkitelli Org. San. Böl., Giy. San. Koop., 3 Ada B Blok, Kat: 1 No: 114, 34670 İkitelli, İstanbul, Türkiye|Clothes|LEVIN TEKSTIL VE OTOMASYON SAN. VE TIC. LTD. STI.|Apparel Clothing
68|Gaziosmanpaşa Bulvarı, Kızılırmak İş Merkezi, No: 58/503, Çankaya, İzmir, Turkey|Clothes|MAYYANA TEKSTIL SAN. TIC. LTD. STI.|Apparel Clothing
69|Hamidiye Mah., Söyler Cad., No: 4, Kat: 5-6, Kağıthane, İstanbul, Turkey|Clothes|DORAMODA TEKSTIL SAN. VE DIS TIC. LTD. STI.|Apparel Clothing
70|Yüzyıl Mah., Otocenter P/Blok, No: 52, Bağcılar, İstanbul, Türkiye|Clothes|NTK GIYIM|Apparel Clothing
71|Didenur Sok., No: 8, Seyrantepe, İstanbul, Turkey|Clothes|SALKIM TEKSTIL SAN. TIC. LTD. STI.|Apparel Clothing
72|Dere Sok., 15/1, Osmanbey, İstanbul, Turkey|Clothes|MILONO CLUB|Apparel Clothing
73|Selamet Mahallesi Kaymak Sokak No:50 Osmangazi, Bursa, Turkey|Clothes|DIKELLER LTD.STI|Apparel Clothing
74|231/A Akcay Cad. Gazıemır-Izmır Turkey|Clothes|CORDON ATHLETICS BERLIN|Apparel Clothing
75|Aziz Mahmut Hüdayi Mah. Hakimiyeti Milliye Cad. Kancal İş Merkezi No:58/102 Üsküdar İstanbul, Turkey|Clothes|MAI TRADE|Apparel Clothing
76|Sanayi Mh. Adem Yavuz sk. no:18-20B kat:1 Gungoren/İstanbul Turkiye|Clothes|FORTY SEVEN|Apparel Clothing
77|Sanayi Mh. Adem Yavuz sk. no:18-20B kat:1 Gungoren/İstanbul Turkiye|Clothes|FORTY SEVEN|Apparel Clothing
78|"Perpa Ticaret Merkezi  - B Blok 
Kat: 5  No: 500
Sisli- Istanbul - Turkey"|Clothes|PROTEX  TEKSTIL SAN. VE TIC. LTD. |Apparel Clothing
79|Merkez Mah. Ziya Gökalp Cad. 27  Güngören-İstanbul   Turkey|Clothes|OZBILICILER TEKSTIL LTD.|Apparel Clothing
80|Hirka-i Serif Mah- Arpa Emini Koprusu Sok 13/21 - Fatih-Istanbul   , Turkey|Clothes|SHAMSALAM|Apparel Clothing
81|Giyimkent Sitesi Oruç Reis Mah. Vadi Cad. No:134 Esenler / İstanbul / Turkey|Clothes|TAMA TEKSTIL SAN. VE DIS TIC. A.S|Apparel Clothing
82|Altınşehir Mah. 303. Sok. No: 215 Nilüfer - Bursa, Turkey|Clothes|OGAN YAPI INSAAT MIMARLIK YATIRIM DANISMANLIK SAN. TIC. LTD. STI.|Apparel Clothing
83|15 May. Neighborhood Atatürk Street Number 41 Denizli / Turkey|Clothes|DENTEKS TEKSTIL SAN. VE TIC. LTD. STI.|Apparel Clothing
84|Hoybar Mah. Ankara Cad. Uygun Han No: 41 Kat: 2 Fatih - İstanbul, Turkey|Clothes|IHTIYACLARIM BURADA BILISIM IC VE DIS TIC. LTD. STI.|Apparel Clothing
85|İstanbul, Turkey|Clothes|34 TEXTILE AGENCY|Apparel Clothing
86|Altınşehir Mah. Uğur Mumcu Bulvarı Atalaykent Sit. No:21 Dörtçelik Çocuk Hastanesi Karşısı Nilüfer/Bursa, Turkey|Clothes|DVC TRADE|Apparel Clothing
87|Merkez Efendı Mh., Sabrı Ulker Sk., No:10 ,Kosan Tekstıl ,Zeytınburnu/ Istanbul|Clothes|KOSAN TEKSTIL|Apparel Clothing
88|"Karatarla Mah. Kumruoglu Sok. Ozdemirishani No:2
Sahinbey/Gaziantep, Turkey"|Clothes|SOYLU TRIKO|Apparel Clothing
89|Yarımburgaz Mah. Istanbul Cad. No:102 Küçükçekmece Istanbul, Turkey|Clothes|BETEKS TEKSTIL TIC. VE SAN. LTD. STI.|Apparel Clothing
90|M. Mazharbey Cad. Sevük Sk. No: 7/15 Göztepe - İstanbul, Turkey|Clothes|MAHINUR BILGEN BABY WEAR AND ACCESSORIES|Apparel Clothing
91|Duacınarı Mah. Altın Sok. No:18/A Yıldırım Bursa Turkey|Clothes|VENTITO BABY|Apparel Clothing
92|İncili Pınar Mah., Nişantaşı Sok., F.H İş Merkezi, No: 11, Kat: 2, D/1, Şehitkamil, Gaziantep, Turkey|Clothes|F&M SAN GIDA DIS TIC. LTD. STI.|Apparel In
93|Çobançeşme Mah., Sanayi Cad., No: 78, Yenibosna, Bahçelievler, İstanbul, Turkey|Clothes|TOP CLOTHINGS SENKO|Apparel In
94|Fulya Mah., Ortaklar Cad., Gündoğdu Apt. No: 8 D: 3, Mecidiyeköy, Şişli, İstanbul, Turkey|Clothes|ND MODA SAN. VE TIC. LTD. STI.|Apparel In
95|Didenur Sok., No: 8, Seyrantepe, İstanbul, Turkey|Clothes|SALKIM TEKSTIL SAN. TIC. LTD. STI.|Apparel In
96|Turkey|Clothes|ECE TUCTURE TEKSTIL URUNLERI HOME OFFICE MUSTERI TEMSILCISI|Apparel In
97|Mahmutbey Mah. Hacı Bostan Cad. Conat Sok. No: 3 Bağcılar - İstanbul, Turkey|Clothes|YIL-BA TEKSTIL SAN. VE TIC. LTD. STI.|Apparel In
98|"Ceyhun Atuf Kansu Caddesi Beycanoglu İs Mrkz No 104/O
Balgat/ Ankara/Turkey"|Clothes|ZAFINA TEKSTIL GIYIM SAN TIC LTD STI|Apparel In
99|Keresteciler Sitesi Limon Sk. No.20 Merter/ İstanbul, Turkey|Clothes|YILMAZ TEKS.SAN.VE TIC.A.S.|Apparel In
100|Tahtakale Cad. Çamaşırcılar Sok. No:12 34460 Istanbul, Turkey|Clothes|YAKUP MURAT VE ORT. KOLL. STI.|Apparel In
101|B.Çekmece Hadımköy Bağlantı Yolu Üzeri No:55 İstanbul, Turkey|Clothes|VIPEKS TEKSTIL URUNLERI SANAYI VE PAZARLAMA A.S.|Apparel In
102|Mithatpaşa Mah.Ardıç Sok. No22 Adapazarı/Turkey|Clothes|VELIOGLU TEKSTIL VE ESARP SAN.VE TIC.LTD.STI.|Apparel In
103|10039 Sok. No:26 Ataturk Org. San.Böl. Çiğli-İzmir, Turkey|Clothes|UNITEKS GIDA TEKSTIL A.S|Apparel In
104|Evren Mah.Gülbahar Cd.Tufan Sk-Evren Mah.Gülbahar Cd.Tufan Sk, Turkey|Clothes|TUTUNCULER TEKS.VE GIY.SAN.TIC|Apparel In
105|Tomurcuk Sk İzmen St. B2 Bl. D90 Mecıdıyeköy İstanbul, Turkey|Clothes|TUREKS ITHALAT IHRACAT VE TICARET A.S.|Apparel In
106|Beş Telsiz M. G-1 Sk. N.24/A Zeytinburnu İstanbul, Turkey|Clothes|TOPO TEKSTIL SAN. VE TIC. LTD. STI.|Apparel In
107|Yıldırım Mah. Akgün Sok. No:12 Bayrampaşa, Turkey|Clothes|TEKSAS TEKSTIL SAN. VE TIC.LTD.STI.|Apparel In
108|İnönü Cad. Hoşgör Sk No.3 80650 4.Levent Istanbul, Turkey|Clothes|TARS ULUSLARARASI DIS TICARET TURIZM VE SANAYI LTD.|Apparel In
109|Sanayi Mh.Şehit Org.Eşref -Sanayi Mh.Şehit Org.Eşref, Turkey|Clothes|SURMELI TRIKO KONF. TURIZM SAN.TIC.LTD.|Apparel In
110|Kerestecıler Sıtesı Gülseven Sok. No20/A Merter Ist., Turkey|Clothes|STIL TRIKO A.S.|Apparel In
111|İstanbul Evleri Çayır Sk. No:11/B Bahçelievler İstanbul, Turkey|Clothes|STEP REKLAM VE TANITIM HZIMETLERI SAN. TIC. LTD. STI.|Apparel In
112|D.Pasa Cd. M.Efendi Sk. Topkapı İstanbul, Turkey|Clothes|SELTEKS TEKSTIL GIYIM SAN VE TIC A.S.|Apparel In
113|Camlik Cad.No.3,Oto Sanayi 4.Levent 80660/Istanbul, Turkey|Clothes|SAVEKS TEKSTIL SANAYI VE TICARET A.S.|Apparel In
114|Mahmutbey Mah. Hacı Bostan Cad. Conat Sok. No: 3 Bağcılar - İstanbul, Turkey|Clothes|CIPO & BAXX YIL-BA TEKSTIL SAN. VE TIC. LTD. STI.|Apparel In
115|İncilipınar Mahallesi 4 Nolu Cadde Yüncüler İş Mrk Kat 3 No 73 Şehitkamil Gaziantep, Turkey|Clothes|FEYZ YAPI INSAAT MUHENDISLIK IC VE DIS TICARET LTD STI|Apparel In
116|Keresteciler Sitesi, Fatih Cd., Mese Sk.,No:1/6, Kahyalar İsm., Merter  İstanbul, Turkey|Clothes|KOZA TRIKO ORME SAN. TIC. LTD. STI.|Apparel In
117|Ağaçişleri Sn:Başkışla Sk:No:23, Turkey|Clothes|PANELRAF|Apparel In
118|Ulukent Tekstil & Promosyon H.Kaplanlar Mh. Barış Cad. No:25, Turkey|Clothes|ULUKENT TEKSTIL PROMOSYON|Apparel In
119|Sucuzade Mahallesi Soydan Caddesi Yalpa İşhanı Kat: 1 No: 103 Seyhan - Adana, Turkey|Clothes|CARMIN TEKSTIL|Apparel In
120|Fatih Cad. Ladin Sok No:6/5 Merter-İst., Turkey|Clothes|GORSIN|Apparel In
121|Fevzipaşa Caddesi 47/3 Küçükbakkalköy-Ataşehir-İ, Turkey|Clothes|MEGASTAR AJANS IC VE DIS TICARET LTD.STI|Apparel In
122|Akçeşme Mah., Bozburun Cad., No:28, Gümüşler, Denizli, Turkey|Clothes|OZER TEKSTIL SAN. VE TIC. LTD. STI.|Apparel Women
123|Çobançeşme Mah., Sanayi Cad., No: 78, Yenibosna, Bahçelievler, İstanbul, Turkey|Clothes|SENKO TEKSTIL SAN. VE TIC. A.S.|Apparel Women
124|DOSAB Papatya Sok. No: 6/1 Bursa, TURKEY|Clothes|APOLENA|Apparel Women
125|İncili Pınar Mah., Nişantaşı Sok., F.H İş Merkezi, No: 11, Kat: 2, D/1, Şehitkamil, Gaziantep, Turkey|Clothes|F&M SAN GIDA DIS TIC. LTD. STI.|Apparel Women
126|Soğanlı Mah., Osmangazi Cad., No: 13, Osmangazi, Bursa, Turkey|Clothes|ESGINLER OTELCILIK INSAAT TEKSTIL TURIZM GIDA SAN. TIC. A.S.|Apparel Women
127|Evren Mah., Gülbahar Cad., Çimen Sok., No: 2, Güneşli, Bağcılar, İstanbul, Turkey|Clothes|AVCI TEKSTIL VE GIYIM SAN. VE TIC. LTD. STI.|Apparel Women
128|Çobançeşme Mah., Sanayi Cad., No: 78, Yenibosna, Bahçelievler, İstanbul, Turkey|Clothes|BATHROBES TOWEL SENKO|Apparel Women
129|Çobançeşme Mah., Sanayi Cad., No: 78, Yenibosna, Bahçelievler, İstanbul, Turkey|Clothes|TOP CLOTHINGS SENKO|Apparel Women
130|Şairginar Sok., No: 71, Osmanbey, İstanbul, Turkey|Clothes|RENGIN GIYIM SAN. VE TIC. LTD. STI.|Apparel Women
131|Organize San. Böl., No: 12, Tokat, Turkey|Clothes|ERBAA SENTURK TEKSTIL SAN. VE TIC. A.S.|Apparel Women
132|"Istanbul Office:Mahmutbey Merkez Mahallesi, Tasocağı Caddesi, No: 7, Bagcılar, İstanbul, Turkey
Factory: Cerkezkoy Organize Sanayi Bolgesi No: 6 Cerkezkoy,Tekirdag,Turkey
"|Clothes|OZEN MENSUCAT BOYA VE TERBIYE ISLETMELERI A.S.|Apparel Women
133|"Emek 8. Cad., 27.Sok., No: 15-A, Ankara, Turkey

 "|Clothes|JEOMED ILAC VE SAGLIK URUNLERI A.S.|Apparel Women
134|Demirtaş Organize San.Böl., Zambak Sok., No:2/A, Osmangazi, Bursa, Turkey|Clothes|GIPECILER TEKSTIL SAN. VE TIC. A.S |Apparel Women
135|Saraylar Mah., Selçuk Cad., Karakurt İş Merkezi, No:6/312, Denizli, Türkiye|Clothes|LINDEN TEKSTIL MERMER GIDA NAKLIYE ITHALAT IHRACAT SAN. VE TIC. LTD. STI.|Apparel Women
136|Mahmudiye Mah., Kuvayi Milliye Cad., Gökdelen İş Merkezi Kat : 13 No : 281, Mersin, Turkey|Clothes|JASMIN ROSE GIDA INS. TAS. TIB.CIH. KUYUM. TEKS. ITH. IHR. SAN. VE TIC. LTD. STI.|Apparel Women
137|Gaziosmanpaşa Bulvarı, Kızılırmak İş Merkezi, No: 58/503, Çankaya, İzmir, Turkey|Clothes|MAYYANA TEKSTIL SAN. TIC. LTD. STI.|Apparel Women
138|Hamidiye Mah., Söyler Cad., No: 4, Kat: 5-6, Kağıthane, İstanbul, Turkey|Clothes|DORAMODA TEKSTIL SAN. VE DIS TIC. LTD. STI.|Apparel Women
139|"Ziya Gokalp Mah., Aymakop Sanayi Sitesi, 
B-4  Blok No: 60, Ikitelli, Basaksehir"|Clothes|ERDO AYAKKABI DERI VE TEKSTIL SAN. TIC. LTD. STI.|Apparel Women
140|Fulya Mah., Ortaklar Cad., Gündoğdu Apt. No: 8 D: 3, Mecidiyeköy, Şişli, İstanbul, Turkey|Clothes|ND MODA SAN. VE TIC. LTD. STI.|Apparel Women
141|Hocapaşa Mah., Nöbethane Cad., Özbey İşhanı, No: 16/401, Sirkeci, Fatih, İstanbul, Turkey|Clothes|OZBEY HIJYENIK URUNLERI SAN. TIC. A.S.|Apparel Women
142|Beyazıt Mah. Mühürdar Emin Paşa Sk. Kardeşler Han. No: B/2 Mercan-Fatih - İstanbul, Turkey|Clothes|VORA TEKSTIL KAGIT VE TEMIZLIK URUNLERI DIS TICARET LTD. STI.|Apparel Women
143|Osmangazi Mah., 3141 Sok., No: 10-12/4, Esenyurt, İstanbul, Turkey|Clothes|ULAS CORAP SAN. TEKS. VE DIS TIC. LTD. STI.|Apparel Women
144|Osman Gazi Mah., Barış Manço Cad., No: 7, İstanbul, Turkey|Clothes|BONI KIMYA SAN. VE TIC. LTD. STI.|Apparel Women
145|İkitelli OSB Mah., Semt Aymakoop C2 Blok Sk. 1 1, Merkez Köyü Merkez Bucağı, Başakşehir, İstanbul, Turkey|Clothes|LEODE DERI VE SAN. TIC. LTD. STI.|Apparel Women
146|Çakmak Mah., Nizip Cad., No:51, Gaziantep, Turkey |Clothes|DOGRU PLASTIK SANAYI KOL. STI. |Apparel Women
147|Yüzyıl Mah., Otocenter P/Blok, No: 52, Bağcılar, İstanbul, Türkiye|Clothes|NTK GIYIM|Apparel Women
148|Mahmutpaşa Cad., Hürriyet Çarşısı, No: 234, Eminönü, Fatih, İstanbul, Turkey|Clothes|ARCAOGLU CEYIZ|Apparel Women
149|Didenur Sok., No: 8, Seyrantepe, İstanbul, Turkey|Clothes|SALKIM TEKSTIL SAN. TIC. LTD. STI.|Apparel Women
150|Mimar Kemalettin Mah. Koska Cad. No 22/A  Laleli- Fatih, Turkey|Clothes|DONAROSA - BY BORAN TEKS.INS VE DIS TIC. LTD STI|Apparel Women
151|O.S.B Çorapcılar Sitesi C Blk No 1 İkitelli  İstanbul, Turkey|Clothes|DOGAN CORAP SAN TIC.LTD.STI.|Apparel Women
152|Fevzi Çakmak Mah., 10638 Sk., No: 3/1 Blok No: 7/B06, Karatay, Konya, Turkey|Clothes|SEVENSAND TEXTILE|Asian Clothing
153|Çobançeşme Mah., Sanayi Cad., No: 78, Yenibosna, Bahçelievler, İstanbul, Turkey|Clothes|TOP CLOTHINGS SENKO|Asian Clothing
154|Yeni Mah., Oba Sk., No: 8, Karahallı, Uşak, Turkey|Clothes|ERCANSOY TEKSTIL MOB. GIDA SAN. VE TIC. LTD. STI.|Asian Clothing
155|Fulya Mah., Ortaklar Cad., Gündoğdu Apt. No: 8 D: 3, Mecidiyeköy, Şişli, İstanbul, Turkey|Clothes|ND MODA SAN. VE TIC. LTD. STI.|Asian Clothing
156|Gaziosmanpaşa Bulvarı, Kızılırmak İş Merkezi, No: 58/503, Çankaya, İzmir, Turkey|Clothes|MAYYANA TEKSTIL SAN. TIC. LTD. STI.|Asian Clothing
157|Hamidiye Mah., Söyler Cad., No: 4, Kat: 5-6, Kağıthane, İstanbul, Turkey|Clothes|DORAMODA TEKSTIL SAN. VE DIS TIC. LTD. STI.|Asian Clothing
158|İkitelli Org. San. Böl., Giy. San. Koop., 3 Ada B Blok, Kat: 1 No: 114, 34670 İkitelli, İstanbul, Türkiye|Clothes|LEVIN TEKSTIL VE OTOMASYON SAN. VE TIC. LTD. STI.|Asian Clothing
159|Didenur Sok., No: 8, Seyrantepe, İstanbul, Turkey|Clothes|SALKIM TEKSTIL SAN. TIC. LTD. STI.|Asian Clothing
160|Dere Sok., 15/1, Osmanbey, İstanbul, Turkey|Clothes|MILONO CLUB|Asian Clothing
161|Yüzyıl Mah., Otocenter P/Blok, No: 52, Bağcılar, İstanbul, Türkiye|Clothes|NTK GIYIM|Asian Clothing
162|DUAÇINARI MAH., VİŞNE CAD. NO 144/Z1, YILDIRIM, BURSA, TÜRKİYE|Clothes|FATIHIM TEKSTIL KONFEKSIYON INSAAT GIDA SAN. VE TIC. A.S.|Asian Clothing
163|Çirişhane Mah Kanalboyu Caddesi 3.Söğüt Sok No:2/2 Osmangazi, Bursa|Clothes|ORSE TEKSTIL KONFEKSIYON GIDA PAZ SAN TIC LTD STI|Asian Clothing
164|Duaçınarı M Yeşilova C. No 37 Yıldırım BURSA|Clothes|SAM BUSINESS TRADIN COMPANY/SAMBIZ IC VE DIS TICARET|Asian Clothing
165|Talatpaşa mahallesi aslangazi caddesi no 15/2 kağıthane/Istanbul|Clothes|SBT EXPORT&IMPORT|Asian Clothing
166|Kartal Sokak, No: 1/1A, Icerenkoy, Atasehir, Istanbul, Turkey|Clothes|MY MOTOSIKLET|Asian Clothing
167|Cebeci Mah., Eski Edirne Asfalti, No: 726, Kat: 2, Sultanciftligi, Istanbul, Turkey|Clothes|DSM TEKSTIL|Asian Clothing
168|M. Nezih Ozmen Mah., Cinar Sokak, Efendioglu Is Merkezi, No: 22, Kat: 4, Istanbul, Turkey|Clothes|JFREE TEKSTIL|Asian Clothing
169|Duacinari Mh., Visne Cd., No: 120/2, Yildirim, Bursa, Turkey|Clothes|BEBUTIK|Asian Clothing
170|Zafer Mah., Ahmet Yesevi Cad., Yuksel Sokak., Gokce Is Merkezi, No: 36/2, Yenibosna, Bahcelievler, Istanbul, Turkey|Clothes|JOLLY TEKSTIL SAN. TIC. LTD. STI.|Asian Clothing
171|Litros Yolu, Yol Sok., No: 1, Kat: 2, Topkapi, Istanbul, Turkey|Clothes|LINEA GIYIM SAN. VE TIC. LTD. STI.|Asian Clothing
172|Mahmut Sevket Pasa Mah., Sahinkaya Sok., No: 13, Azim Plaza, Okmeydani, Sisli, Istanbul, Turkey|Clothes|ETU TEKSTIL SAN. VE DIS TIC. LTD. STI.|Asian Clothing
173|Fabrikalar Cad. No : 62/A Gumusler - Denizli|Clothes|MER TEKSTIL|Asian Clothing
174|Perpa Ticaret Merkezi, B Blok, Yesil Avlu, Kat: 2, No: 35, Okmeydani, Sisli, Istanbul, Turkey|Clothes|EURO PROTECTION|Asian Clothing
175|Kavacik Mah., Sehit Tegmen Ali Yılmaz Sok., No: 15, Beykoz, Istanbul, Turkey|Clothes|RUNTEK MAGAZACILIK TEKSTIL VE TIC. A. S.|Asian Clothing
176|Bağlar mah Osmanpaşa Cad. No-55 Güneşli - İST|Clothes|SELTA GRUP LTD STI|Asian Clothing
177|Kocaoglan Mahallesi Demokrasi Bulvari No:41 27100 Sahinbey Gaziantep Turkiye|Clothes|BURAK DIS TICARET|Asian Clothing
178|Demirtas Dumlupinar Mahallesi, 51. Sokak, No: 14/1, Osmangazi, Turkey|Clothes|FIBRA WORLD TEXTILE|Asian Clothing
179|Barakfakih Mahallesi 17. Cadde no:7 Kestel/BURSA|Clothes|UNS TEKSTIL SAN. VE TIC. LTD. STI. |Asian Clothing
180|sarımeşe mh bağdat yolu cd no:23/b  kartepe kocaeli|Clothes|JAGUAR GIDA TURIZM TEKSTIL SAN.TIC.LTD.STI.|Asian Clothing
181|AKSARAY MAH. MİLLET CAD. NO:21 KAT:2 D:4 YUSUFPAŞA - FATİH. İSTANBUL|Clothes|EF GRUP ULUSLARARASI|Asian Clothing
182|İncili Pınar Mah., Nişantaşı Sok., F.H İş Merkezi, No: 11, Kat: 2, D/1, Şehitkamil, Gaziantep, Turkey|Clothes|F&M SAN GIDA DIS TIC. LTD. STI.|Athletic Apparel
183|Çobançeşme Mah., Sanayi Cad., No: 78, Yenibosna, Bahçelievler, İstanbul, Turkey|Clothes|TOP CLOTHINGS SENKO|Athletic Apparel
184|Fulya Mah., Ortaklar Cad., Gündoğdu Apt. No: 8 D: 3, Mecidiyeköy, Şişli, İstanbul, Turkey|Clothes|ND MODA SAN. VE TIC. LTD. STI.|Athletic Apparel
185|Didenur Sok., No: 8, Seyrantepe, İstanbul, Turkey|Clothes|SALKIM TEKSTIL SAN. TIC. LTD. STI.|Athletic Apparel
186|Turkey|Clothes|ECE TUCTURE TEKSTIL URUNLERI HOME OFFICE MUSTERI TEMSILCISI|Athletic Apparel
187|Mahmutbey Mah. Hacı Bostan Cad. Conat Sok. No: 3 Bağcılar - İstanbul, Turkey|Clothes|YIL-BA TEKSTIL SAN. VE TIC. LTD. STI.|Athletic Apparel
188|"Ceyhun Atuf Kansu Caddesi Beycanoglu İs Mrkz No 104/O
Balgat/ Ankara/Turkey"|Clothes|ZAFINA TEKSTIL GIYIM SAN TIC LTD STI|Athletic Apparel
189|Keresteciler Sitesi Limon Sk. No.20 Merter/ İstanbul, Turkey|Clothes|YILMAZ TEKS.SAN.VE TIC.A.S.|Athletic Apparel
190|Tahtakale Cad. Çamaşırcılar Sok. No:12 34460 Istanbul, Turkey|Clothes|YAKUP MURAT VE ORT. KOLL. STI.|Athletic Apparel
191|B.Çekmece Hadımköy Bağlantı Yolu Üzeri No:55 İstanbul, Turkey|Clothes|VIPEKS TEKSTIL URUNLERI SANAYI VE PAZARLAMA A.S.|Athletic Apparel
192|Mithatpaşa Mah.Ardıç Sok. No22 Adapazarı/Turkey|Clothes|VELIOGLU TEKSTIL VE ESARP SAN.VE TIC.LTD.STI.|Athletic Apparel
193|10039 Sok. No:26 Ataturk Org. San.Böl. Çiğli-İzmir, Turkey|Clothes|UNITEKS GIDA TEKSTIL A.S|Athletic Apparel
194|Evren Mah.Gülbahar Cd.Tufan Sk-Evren Mah.Gülbahar Cd.Tufan Sk, Turkey|Clothes|TUTUNCULER TEKS.VE GIY.SAN.TIC|Athletic Apparel
195|Tomurcuk Sk İzmen St. B2 Bl. D90 Mecıdıyeköy İstanbul, Turkey|Clothes|TUREKS ITHALAT IHRACAT VE TICARET A.S.|Athletic Apparel
196|Beş Telsiz M. G-1 Sk. N.24/A Zeytinburnu İstanbul, Turkey|Clothes|TOPO TEKSTIL SAN. VE TIC. LTD. STI.|Athletic Apparel
197|Yıldırım Mah. Akgün Sok. No:12 Bayrampaşa, Turkey|Clothes|TEKSAS TEKSTIL SAN. VE TIC.LTD.STI.|Athletic Apparel
198|İnönü Cad. Hoşgör Sk No.3 80650 4.Levent Istanbul, Turkey|Clothes|TARS ULUSLARARASI DIS TICARET TURIZM VE SANAYI LTD.|Athletic Apparel
