|Address|Category|Name|Subcategory
0|Fevzi Çakmak Mah., Ayyıldız Cad., No: 69, Karatay, Konya, Turkey|Elevator|SUMAK METAL DEGIRMEN MAKINELERI PETROL OTOMOTIV INSAAT SAN. VE TIC. LTD. STI.|Access Elevator
1|Ramazanoğlu Mah., Kaynarca Cad., Gürsu Sk., No:6, Pendik, İstanbul, Turkey|Elevator|RMT ASANSOR SAN. TIC. LTD. STI.|Access Elevator
2|Çuhane Cad., No: 130, Köseköy, Kartepe, Kocaeli, Turkey|Elevator|OZAK GECIS TEKNOLOJILERI SAN. TIC. A.S.|Access Elevator
3|İMES San. Sit., E Blok 504. Sk., No:23, 34776 Dudullu, Ümraniye, İstanbul, Turkey|Elevator|IDA ISTANBUL LIFT ASANSOR SAN. TIC. LTD. STI.|Access Elevator
4|2. Organize San. Bölgesi, 2. Cadde, No:12 /22, Malatya, Turkey|Elevator|ASAM DIS TICARET LTD. STI.|Access Elevator
5|Sahipata Mah., Mimar Muzaffer Cad., Alaaddin İş Hanı, No: 11/218, Meram, Konya, Turkey|Elevator|INCIR ENERJI SANAYI VE TICARET LTD. STI.|Access Elevator
6|Yaşamkent Mah., 3207 Cad., 3204. Sk., No: 8, 06810, Yaşamkent, Ankara, Turkey|Elevator|MEGA ENDUSTRI KONTROL SISTEMLERI TIC. LTD. STI.|Access Elevator
7|Üçgen Mahallesi  Güllük Caddesi, Savaş Apt. No:82, Muratpaşa, Antalya, Turkey|Elevator|TURKISH TRADE CONSULTANT AND ANALYSIS COMPANY|Access Elevator
8|Hürriyet Mah., Erler Sok., No:16/A, Kartal, İstanbul, Türkiye|Elevator|METROPLAST ASANSOR MALZ. IMA. LTD. STI.|Access Elevator
9|Soğanlık Orta Mh., Yanlız Selvi Cd., Güzelgün Sk., No: 19, Kartal, İstanbul, Türkiye|Elevator|CERSAN ASANSOR INSAAT GIDA TURIZM IC VE DIS TIC. LTD. STI.|Access Elevator
10|"Başkent OSB, Recep Tayyip Erdoğan Bulvarı, No: 8, 
Malıköy, Temelli, Ankara, Turkey"|Elevator|MERIH ASANSOR SAN. VE TIC. A.S.|Access Elevator
11|600 Evler Mahallesi Balıkesir Asfaltı Sol Taraf Caddesi No:65 Bandırma, Turkey|Elevator|YEMTAR MAKINA VE SANAYI TIC. A.S|Access Elevator
12|Arifiye Mahallesi İnhisar Sokak 6/7 Eskişehir Turkey|Elevator|SITIMEK ASANSOR|Access Elevator
13|Cumhuriyet Bulvari No:192/4 Konak/Alsancak/İzmir, Turkey|Elevator|3E PROJE A.S|Access Elevator
14|Adil Mah. Said Nursi Cad. No: 28 - Sultanbeyli / İstanbul Turkey|Elevator|CEO LIFT ASANSOR SAN. VE TIC. LTD. STI|Access Elevator
15|Fevzi Çakmak Mah.  10569 Sok  No 17, Turkey|Elevator|BUTKON ASANSOR MUH. DOG. GIDA SAN. TIC. LTD. STI.|Access Elevator
16|"Fevzi Cakmak Mahallesi Aslim Caddesi No:38/S 
Karatay / Konya/Turkey"|Elevator|STOF LIFT COMPONENTS|Access Elevator
17|Horozluhan Mah. Özge Sok. No:23 Selçuklu / Konya / Turkey|Elevator|SLM MAKINA|Access Elevator
18|İstanbul Anadolu Yakası Organize Sanayi Bölgesi Mermerciler Caddesi No: 10 Tuzla - İstanbul, Turkey|Elevator|GRAVIT ASANSOR MAKINALARI SAN. VE TIC. LTD. STI.|Access Elevator
19|Süvari Mahallesi 143.Sk. No:3/8 Etimesgut, Turkey|Elevator|ERK EXPORT&IMPORT COMPANY|Access Elevator
20|Kale Mahallesi Ankara Caddesi 13.Km No:77 Kestel/Bursa, Turkey|Elevator|HAS ELEVATOR CO.|Access Elevator
21|Ağaç İşleri San.Sit.1354.Cad.1371.Sok.No:36 İvedik  Osb / Ankara - Turkey|Elevator|M.A.S. MAKINA ASANSOR SANAYI VE TIC. LTD. STI.|Access Elevator
22|İvedik Organize Sanayi Bölgesi, Street 1419, No:72, 06370, İvogsan –  Ankara - Turkey|Elevator|VIDEOCOM AKILLI BINA SISTEMLERI|Access Elevator
23|Aktaş Mah. Taşhancılar Cad. No: 15/2 Bolu - Turkey|Elevator|DVN MUHENDISLIK ASANSOR INSAAT SAN. TIC. LTD. STI.|Access Elevator
24|Organize Sanayi Bölgesi 9. Cadde No:5 26110 Eskişehir / Turkey|Elevator|ALTINBILEK MAKINA INS. SAN. VE TIC. LTD. STI.|Access Elevator
25|Oto Esnaflar San. Sit. 11253 Sk. (F Blok) No:24 Eskişehir -  Turkey|Elevator|EDK END. URUNLER METAL MAK. INS. SAN. VE TIC. LTD. STI.|Access Elevator
26|"Organize Sanayi Bölgesi 10.Cadde No : 15 26110 
Eskişehir - Turkey"|Elevator|ERGUNLER PRES DOKUM KALIP MAKINA SANAYI VE TICARET ANONIM SIRKETI|Access Elevator
27|Organize Sanayi Bölgesi Emko Sanayi Sitesi E9 Blok No:1 Eskişehir / Turkey|Elevator|KAS METAL ELEKTRONIK SAN. TIC. LTD. STI.|Access Elevator
28|Organize Sanayi Bölgesi 9. Cadde No. 36 26210 Eskişehir / Turkey|Elevator|TANATAR KALIP PRES ISLERI SANAYI VE TICARET LIMITED SIRKETI|Access Elevator
29|Fevzi Çakmak Mah. Büsan 4 Org. San. Böl. Aslım Cd. No: 35 Karatay - Konya, Turkey|Elevator|VITAL ASANSOR ELEKTRIK ELEKTRONIK MAKINA SAN. VE TIC. LTD. STI.|Access Elevator
30|Fevzi Çakmak Mah., Ayyıldız Cad., No: 69, Karatay, Konya, Turkey|Elevator|SUMAK METAL DEGIRMEN MAKINELERI PETROL OTOMOTIV INSAAT SAN. VE TIC. LTD. STI.|Access Elevator Lift
31|Ramazanoğlu Mah., Kaynarca Cad., Gürsu Sk., No:6, Pendik, İstanbul, Turkey|Elevator|RMT ASANSOR SAN. TIC. LTD. STI.|Access Elevator Lift
32|Çuhane Cad., No: 130, Köseköy, Kartepe, Kocaeli, Turkey|Elevator|OZAK GECIS TEKNOLOJILERI SAN. TIC. A.S.|Access Elevator Lift
33|İMES San. Sit., E Blok 504. Sk., No:23, 34776 Dudullu, Ümraniye, İstanbul, Turkey|Elevator|IDA ISTANBUL LIFT ASANSOR SAN. TIC. LTD. STI.|Access Elevator Lift
34|2. Organize San. Bölgesi, 2. Cadde, No:12 /22, Malatya, Turkey|Elevator|ASAM DIS TICARET LTD. STI.|Access Elevator Lift
35|Sahipata Mah., Mimar Muzaffer Cad., Alaaddin İş Hanı, No: 11/218, Meram, Konya, Turkey|Elevator|INCIR ENERJI SANAYI VE TICARET LTD. STI.|Access Elevator Lift
36|Musalla Bağları Mah., Babür Sok., No: 1/A, Selçuklu, Konya, Turkey|Elevator|HEDA VINC NAK. METAL INS. MAD. SAN. TIC. LTD. STI.|Access Elevator Lift
37|Üçgen Mahallesi  Güllük Caddesi, Savaş Apt. No:82, Muratpaşa, Antalya, Turkey|Elevator|TURKISH TRADE CONSULTANT AND ANALYSIS COMPANY|Access Elevator Lift
38|Hürriyet Mah., Erler Sok., No:16/A, Kartal, İstanbul, Türkiye|Elevator|METROPLAST ASANSOR MALZ. IMA. LTD. STI.|Access Elevator Lift
39|Yaşamkent Mah., 3207 Cad., 3204. Sk., No: 8, 06810, Yaşamkent, Ankara, Turkey|Elevator|MEGA ENDUSTRI KONTROL SISTEMLERI TIC. LTD. STI.|Access Elevator Lift
40|Soğanlık Orta Mh., Yanlız Selvi Cd., Güzelgün Sk., No: 19, Kartal, İstanbul, Türkiye|Elevator|CERSAN ASANSOR INSAAT GIDA TURIZM IC VE DIS TIC. LTD. STI.|Access Elevator Lift
41|"Başkent OSB, Recep Tayyip Erdoğan Bulvarı, No: 8, 
Malıköy, Temelli, Ankara, Turkey"|Elevator|MERIH ASANSOR SAN. VE TIC. A.S.|Access Elevator Lift
42|Büsan Organize Sanayi Sitesi Fevzi Çakmak Mah. 10625. Sok. No: 5/I Karatay - Konya, Turkey|Elevator|KUCUK BURO MAKINELERI KABLO BILISIM INSAAT IMALAT SAN. TIC. A.S.|Access Elevator Lift
43|İtob Org. San. Bölgesi Tekeli Bedeli - İzmir, Turkey|Elevator|BILGE SU BASINC KONTROL VANALARI SAN. TIC. LTD. STI.|Access Elevator Lift
44|İvedik Org. San Öz Ankara Sit 22. Cd 690 Sk. No:57  Ostim Ankara, Turkey|Elevator|KEYVAN MAKINA-VIDA IMALAT SANAYI|Access Elevator Lift
45|Çankırı Yolu 23. Km. Akyurt, Turkey|Elevator|ORMAKSAN HIDROLIK VE MAKINA SAN. TIC. LTD. STI.|Access Elevator Lift
46|100.Yıl Bulvari No:14/C, Turkey|Elevator|ON-FA YAPI MALZEMELERI LTD.STI.|Access Elevator Lift
47|152 Evler Mh. Eğitim Cd. No:66, Turkey|Elevator|POTANSIYEL METAL|Access Elevator Lift
48|Gümüşsuyu Cd.No:34 Zeytinburnu, Turkey|Elevator|ILKERLER OTOMOTIV-FEDERAL POWER|Access Elevator Lift
49|Plastikçiler  San. Sit. 580. Sk. No:2   , Turkey|Elevator|ZEYMAK ASANSOR MARKET  LTD. STI. |Access Elevator Lift
50|Necatibey Cad. Vekilharç Sok. No:20 Karaköy, Turkey|Elevator|GUVEN DEGIRMEN MALZ. TIC. LTD. STI.|Access Elevator Lift
51|Kızılırmak Caddesi No 7 / A Bakanlıklar Ankara, Turkey|Elevator|PVC PLASTIK KART SISTEMLERI|Access Elevator Lift
52|Çankırı Caddesi Anadolu İşhanı 22/30-31 Ulus, Turkey|Elevator|HSB ASANSOR|Access Elevator Lift
53|Samandıra Ferhatpaşa Mahallesi Fevzi Çakmak Caddesi No 112 Kartal, Turkey|Elevator|TEORI MUHENDISLIK ASANSOR SANAYI VE TICARET LTD. STI.|Access Elevator Lift
54|Çanakkale Cad. 7109 Sokak No:3 Pınarbaşı İzmir, Turkey|Elevator|HIPERMAK GIDA AMBALAJ MAKINE SANAYI VE TIC.LTD.STI|Access Elevator Lift
55|Karatay Sanayi Sariyer Sk:22, Turkey|Elevator|OZCETINLERHIDROLIK|Access Elevator Lift
56|Deri Organize Sanayi Bölgesi 22. Sokak No:16 Orhanlı Mevkii Tuzla, Turkey|Elevator|KILAVUZ MAKINA DIS TICARET VE SANAYI LTD. STI.|Access Elevator Lift
57|Deri Organize Sanayi Bölgesi 22. Sokak No:16 Orhanlı Mevkii Tuzla, Turkey|Elevator|KILAVUZ MAKINA DIS TICARET VE SANAYI LTD. STI.|Access Elevator Lift
58|Kartal Cad. No:71 Yakacık, Turkey|Elevator|MP YENER OVUNC ASANSOR SAN. VE TIC. LTD. STI.|Access Elevator Lift
59|"Horozluhan Mah. Öksüz Cad. Topkapı Sanayi Sitesi No: 129  Selçuklu - Konya 
, Turkey"|Elevator|ISLEYEN MAKINA HIDROLIK UNITE VE LIFT IMALATI|Access Elevator Lift
60|Ramazanoğlu Mah., Kaynarca Cad., Gürsu Sk., No:6, Pendik, İstanbul, Turkey|Elevator|RMT ASANSOR SAN. TIC. LTD. STI.|Accessible Lift
61|İMES San. Sit., E Blok 504. Sk., No:23, 34776 Dudullu, Ümraniye, İstanbul, Turkey|Elevator|IDA ISTANBUL LIFT ASANSOR SAN. TIC. LTD. STI.|Accessible Lift
62|Fevzi Çakmak Mah., Ayyıldız Cad., No: 69, Karatay, Konya, Turkey|Elevator|SUMAK METAL DEGIRMEN MAKINELERI PETROL OTOMOTIV INSAAT SAN. VE TIC. LTD. STI.|Accessible Lift
63|2. Organize San. Bölgesi, 2. Cadde, No:12 /22, Malatya, Turkey|Elevator|ASAM DIS TICARET LTD. STI.|Accessible Lift
64|Soğanlık Orta Mh., Yanlız Selvi Cd., Güzelgün Sk., No: 19, Kartal, İstanbul, Türkiye|Elevator|CERSAN ASANSOR INSAAT GIDA TURIZM IC VE DIS TIC. LTD. STI.|Accessible Lift
65|Büsan Organize Sanayi Sitesi Fevzi Çakmak Mah. 10625. Sok. No: 5/I Karatay - Konya, Turkey|Elevator|KUCUK BURO MAKINELERI KABLO BILISIM INSAAT IMALAT SAN. TIC. A.S.|Accessible Lift
66|"Başkent OSB, Recep Tayyip Erdoğan Bulvarı, No: 8, 
Malıköy, Temelli, Ankara, Turkey"|Elevator|MERIH ASANSOR SAN. VE TIC. A.S.|Accessible Lift
67|Hürriyet Mah., Erler Sok., No:16/A, Kartal, İstanbul, Türkiye|Elevator|METROPLAST ASANSOR MALZ. IMA. LTD. STI.|Accessible Lift
68|Musalla Bağları Mah., Babür Sok., No: 1/A, Selçuklu, Konya, Turkey|Elevator|HEDA VINC NAK. METAL INS. MAD. SAN. TIC. LTD. STI.|Accessible Lift
69|Esentepe Mah Milangaz Cad Aydos Sok No : 24a-b Kartal, ISTANBUL, TURKEY |Elevator|SEYITOGLU ASANSOR KABIN MAK. SAN. TIC.|Accessible Lift
70|GAZİLER CAD. YENİŞEHİR İŞ MERKEZİ 478\D İZMİR, TURKEY |Elevator|TRDOOR|Accessible Lift
71|gökkuşağı cad No 67 balgat 7 Ankara, Turkey |Elevator|GENTAS INS. ASANSOR ELEKT. MUH.|Accessible Lift
72|Fevzi Çakmak Mah. Sıla Cad.  : No :30 Büsan San. BölgesiKARATAY / KONYA / Turkey|Elevator|FMS HIDROLIK LTD.STI.|Accessible Lift
73|Şerifali Mah. Bayraktar Bulvarı Garip Sok. No: 41 Kat: 1 Ümraniye/İSTANBUL TURKEY|Elevator|BETA ASANSOR SAN. VE TIC. LTD. STI.|Accessible Lift
74|Alaattin bey mah. 638 sk.no:5 NilüferBURSA TURKEY|Elevator|DIASANSOR ASANSOR SAN. VE TIC. LTD. STI.|Accessible Lift
75|Varyap Meridian A-Blok Grand Tower K:3 D:41 Batı Ataşehir/İstanbul TURKEY|Elevator|HMF ASANSOR VE SERVIS SANAYI VE TICARET A.S.|Accessible Lift
76|Menekşe Sok.No 13/10 kat:3 Kızılay/Ankara Turkey|Elevator|IZGUR ASANSOR SAN. TIC. LTD. STI.|Accessible Lift
77|Mimar Sinan Mah.Bosna cad.Güven 1 İş MerkeziNo:4 Kat :3 Daire 10 Çekmeköy / İstanbul TURKEY|Elevator|KONUT ASANSOR SAN. VE TIC. LTD. STI.|Accessible Lift
78|Şerifali Mah. Şehit Sok. No:32 Yukarı Dudullu / Ümraniye - İstanbul - TURKEY|Elevator|LOTTA ASANSOR LTD. STI.|Accessible Lift
79|Atatürk Bulvarı Sanayi Sitesi Yanı Bayır / MUĞLA/turkey|Elevator|EKIP ARAC USTU EKIPMAN SAN. IMALAT MADENCILIK TAAHHUT TUR. VE TIC. LTD. STI.|Accessible Lift
80|İvogsan Dericiler Sanayi Sitesi 609. Sk. (1394) No : 22 Ostim - ANKARA TURKEY|Elevator|RPM ELEKTRONIK LTD. STI.|Accessible Lift
81|Mareşal Fevzi Çakmak Bulvarı No:166 Zeytinalanı Urla/İZMİR TURKEY|Elevator|ONKA CELIK KAPI|Accessible Lift
82|Otakçılar Cad. Eyüp İş Merkezi No:62 - 40 Eyüp / İstanbul TURKEY|Elevator|ONERSAN ASANSOR|Accessible Lift
83| KADIPAŞA MAH. DEVECİLER SK. K.1 D.1 TIKMAK APT. NO:26 ALANYA/ANATALYA/ turkey|Elevator|BILISIM ASANSOR VE YURUYEN MERD.TUR.INS.EML.GIDA ITH.IHR.SAN.VE TIC.LTD.STI.|Accessible Lift
84|Adil Mah. Said Nursi Cad. No: 28 - Sultanbeyli / İstanbul Turkey|Elevator|CEO LIFT ASANSOR SAN. VE TIC. LTD. STI|Accessible Lift
85|"Fevzi Cakmak Mahallesi Aslim Caddesi No:38/S 
Karatay / Konya/Turkey"|Elevator|STOF LIFT COMPONENTS|Accessible Lift
86|Modern Sanayi Sitesi, Erenler Sakarya - Turkey|Elevator|ORLIFT MAKINA VE OTOMOTIV SERVIS EKIPMANLARI|Accessible Lift
87|İstanbul Anadolu Yakası Organize Sanayi Bölgesi Mermerciler Caddesi No: 10 Tuzla - İstanbul, Turkey|Elevator|GRAVIT ASANSOR MAKINALARI SAN. VE TIC. LTD. STI.|Accessible Lift
88|Kale Mahallesi Ankara Caddesi 13.Km No:77 Kestel/Bursa, Turkey|Elevator|HAS ELEVATOR CO.|Accessible Lift
89|1.Organize Sanayi Bölgesi Karamanlılar Cad. No: 13 - 15-Sincan - Ankara, Turkey|Elevator|MOR ALUMINYUM MELATURJI MAKINA INSAAT SAN. VE TIC. LTD. STI.|Accessible Lift
90|Ramazanoğlu Mah., Kaynarca Cad., Gürsu Sk., No:6, Pendik, İstanbul, Turkey|Elevator|RMT ASANSOR SAN. TIC. LTD. STI.|Accessible Lifts
91|2. Organize San. Bölgesi, 2. Cadde, No:12 /22, Malatya, Turkey|Elevator|ASAM DIS TICARET LTD. STI.|Accessible Lifts
92|İMES San. Sit., E Blok 504. Sk., No:23, 34776 Dudullu, Ümraniye, İstanbul, Turkey|Elevator|IDA ISTANBUL LIFT ASANSOR SAN. TIC. LTD. STI.|Accessible Lifts
93|Musalla Bağları Mah., Babür Sok., No: 1/A, Selçuklu, Konya, Turkey|Elevator|HEDA VINC NAK. METAL INS. MAD. SAN. TIC. LTD. STI.|Accessible Lifts
94|Esenkent Mah., Muhterem Sk., NG131 Sk. No: 50/1, Ümraniye, İstanbul, Turkey|Elevator|ETA MEKATRONIK SAN. TIC. LTD. STI.|Accessible Lifts
95|"Başkent OSB, Recep Tayyip Erdoğan Bulvarı, No: 8, 
Malıköy, Temelli, Ankara, Turkey"|Elevator|MERIH ASANSOR SAN. VE TIC. A.S.|Accessible Lifts
96|Organize San. Böl., Kuddusi Cad., No: 30, Selçuklu, Konya, Turkey|Elevator|ALTIN BURO DAYANIKLI TUKETIM MALZEMELERI SAN. VE TIC. LTD. STI.|Accessible Lifts
97|Hacı Yusuf Mescit Mahallesi Özkafa Sokak No:105 Karatay / Konya / Turkey|Elevator|BORO CLINDAS ELEVATORS, LIFTS & THEIR MOTORS|Accessible Lifts
98|Kazim Dirik St. N:17 Bornova, Turkey|Elevator|KUCUKOGLU MACHINE CO|Accessible Lifts
99|Murat Mah.Dökümcüler Cad. No:20/A Bayrampaşa İstanbul/ Turkey|Elevator|DAPSAN LTD.STI. PASSENGER ELEVATORS LOAD LIFTS ESCALATORS TURKEY|Accessible Lifts
100|Off Atatürk Airport Istanbul World Trade Center A1 Tower   Istanbul/Turkey|Elevator|KTPARTS TRUCK AND TRAILER PARTS|Accessible Lifts
101|Horozluhan Mah. Zerdali Sk. No:6/A 42120 Selçuklu Konya (Anadolu Sanayi Girişi)|Elevator|MESUT VINC|Accessible Lifts
102|İstanbul Yolu 25. Km Aksoy Cad. No: 12 Sarayköy-Kazan - Ankara, Turkey|Elevator|YUKSELIS ASANSORLERI PAZARLAMA INSAAT OTOMOTIV TURIZM ITHALAT IHRACAT SAN. VE TIC. LTD. STI.|Accessible Lifts
103|Turkey|Elevator|ETKIN HAREKETLI PLATFORM|Accessible Lifts
104|10. Sokak No:32 06640 Ostim / Ankara - Turkey|Elevator|ARKENG|Accessible Lifts
105|Organize San. Böl. Atatürk Bulvarı No: 35 - Antalya, Turkey|Elevator|AKE ASANSOR MALZEMELERI PAZARLAMA LTD. STI.|Accessible Lifts
106|Eski Sanayi Bölgesi 3. Cad. 14. Sk. No: 31-33 - Kayseri, Turkey|Elevator|KAYNAK HUNER ENDUSTRIYEL MAKINA INSAAT HIRDAVAT SAN. TIC. LTD. STI.|Accessible Lifts
107|Fevzi Çakmak Mahallesi Astim Sanayi Sitesi 10753. Sokak No:26/D Karatay - Konya, Turkey|Elevator|ASKAPISAN ASANSOR KAPI KABIN IMALAT SAN. TIC. LTD. STI.|Accessible Lifts
108|Mustafa Şimşek Cad. No:50 - Kayseri, Turkey|Elevator|AKMETAL ASANSOR VE YAPI MALZEMELERI IMALAT SAN. VE TIC. LTD. STI.|Accessible Lifts
109|Ataturk Organize Sanayi Bolgesi, 10001 Sokak, No: 15, Cigli, Izmir, Turkey|Elevator|BORLAN IC VE DIS TIC. LTD. STI.|Accessible Lifts
110|Dicle Cad. No:17 Atakent-Ümraniye/İstanbul, Turkey|Elevator|AGM ASANSOR VE YAPI SAN. LTD. STI.|Accessible Lifts
111|Atatürk Cad. Esin Sk. Yazgan İş Mer. No:3 K:6 Kozyatağı-İstanbul, Turkey|Elevator|ASTEK ASANSOR SAN. VE TIC. A.S.|Accessible Lifts
112|Balbandere Cad. Çayır Sok. No:3 34460 İstinye-Sarıyer İstanbul, Turkey|Elevator|BUGA-OTIS ASANSOR SAN. VE TIC. A.S.|Accessible Lifts
113|Kore Şehitleri Cad. No:26/4 Zincirlikuyu-İstanbul, Turkey|Elevator|BULGU MUHENDISLIK ASANSOR SAN. TIC. LTD. STI.|Accessible Lifts
114|Niyazi Mısri Cad. 1. Sok. No:17/A Malatya, Turkey|Elevator|DUNDAR ASANSOR - UCGEN MUH. SAN. VE TIC. LTD. STI.|Accessible Lifts
115|Doğu Mh. Ihlamur Sk. No:36/1 Pendik-İstanbul, Turkey|Elevator|EDESSA ELEKTRIK ASANSOR SAN. VE TIC. LTD. STI.|Accessible Lifts
116|Recep Peker Cad. Kördere Sk.Serdar Apt. No:19 D:7 Kızıltoprak-Kadıköy/İstanbul, Turkey|Elevator|ERMAS ASANSOR SAN. VE TIC. LTD. STI.|Accessible Lifts
117|Hacı Halil Mh. Adliye Cad. S.Boyacı İş Apt. No:14/1 Gebze-İzmit, Turkey|Elevator|GEMAK GEBZE MAK. ELK. ASANSOR SAN. TIC. LTD. STI.|Accessible Lifts
118|Zümrütevler Mah. Atatürk Cd. Mimoza Sok. No 40 Maltepe/İstanbul, Turkey|Elevator|GM ASANSOR SAN. VE TIC LTD. STI.|Accessible Lifts
119|Yunus Emre Mah. Veysel Karani Cad. Tabiat Sk. No:19 Yenidogan 34791 Sancaktepe / Istanbul, Turkey|Elevator|GTS ASANSOR SAN VE TIC. LTD. STI.|Accessible Lifts
120|Eskibüyükdere Cad., Güvercin Sk., No: 3 34415, 4. Levent, Kağıthane, İstanbul, Turkey|Elevator|ASAS OTOMOTIV INS. SAN. VE TIC .A.S.|Building Elevator
121|Organize Sanayi Bölgesi Avrupa Hun Bulvarı No:8 06935 Sincan - Ankara, Turkey|Elevator|FIRAT PLASTIK KAUCUK SAN. VE TIC. A.S.|Building Elevator
122|Hançerli Mh., 100. Yıl Bulvarı, No: 37, İlkadim, Samsun, Turkey|Elevator|OZER TEKNIK ISI VE TESISAT TIC. LTD. STI.|Building Elevator
123|19 Mayıs Mah. Sinan Ercan Cad. Paşa Korusu Sit. No: 18 B1 Blok 34736 Kadıköy-İstanbul, Turkey|Elevator|UTA DIS TICARET LTD. STI.|Building Elevator
124|Organize San. Böl., 41. Cadde, No: 1, Melikgazi, Kayseri, Turkey|Elevator|FLY BOYA YAPI KIMYASALLARI INSAAT SAN. VE TIC. A.S.|Building Elevator
125|Hançerli Mh., 100. Yıl Bulvarı, No: 37, İlkadim, Samsun, Turkey|Elevator|IFYIL STOVE|Building Elevator
126|Saraylar Mah., Hastahane Cad., No: 4, Fehmi Cillov İşhanı Kat: 2 No: 204, Merkezefendi, Denizli, Turkey|Elevator|DIAMON TEKNIK HIZMETLER VE TICARET LTD. STI.|Building Elevator
127|Fevzi Çakmak Mah., Ayyıldız Cad., No: 69, Karatay, Konya, Turkey|Elevator|SUMAK METAL DEGIRMEN MAKINELERI PETROL OTOMOTIV INSAAT SAN. VE TIC. LTD. STI.|Building Elevator
128|Sahipata Mah., Mimar Muzaffer Cad., Alaaddin İş Hanı, No: 11/218, Meram, Konya, Turkey|Elevator|INCIR ENERJI SANAYI VE TICARET LTD. STI.|Building Elevator
129|Ramazanoğlu Mah., Kaynarca Cad., Gürsu Sk., No:6, Pendik, İstanbul, Turkey|Elevator|RMT ASANSOR SAN. TIC. LTD. STI.|Building Elevator
130|Soğanlı Mah., Osmangazi Cad., No: 13, Osmangazi, Bursa, Turkey|Elevator|ESGINLER OTELCILIK INSAAT TEKSTIL TURIZM GIDA SAN. TIC. A.S.|Building Elevator
131|Beşköprü Mah., D-100 Karayolu Cad., No: 130, Serdivan, Sakarya, Turkey|Elevator|EUROPROM OTOMOTIV DIS TICARET IMALAT SAN. VE LTD. STI.|Building Elevator
132|İMES San. Sit., E Blok 504. Sk., No:23, 34776 Dudullu, Ümraniye, İstanbul, Turkey|Elevator|IDA ISTANBUL LIFT ASANSOR SAN. TIC. LTD. STI.|Building Elevator
133|2. Organize San. Bölgesi, 2. Cadde, No:12 /22, Malatya, Turkey|Elevator|ASAM DIS TICARET LTD. STI.|Building Elevator
134|Kuzguncuk Mah., Gümüşyolu Cad., Rasimağa Sok., No: 11/1, Nakkaştepe, Üsküdar, İstanbul, Türkiye|Elevator|SINTEZ KIMYA|Building Elevator
135|Maltepe Mah., Dokumacılar Sitesi Sk., Hacıbey İş Hanı, No: 8/2, Zeytinburnu, İstanbul, Türkiye|Elevator|SAY STEEL INOX CONSTRUCTION PRODUCTS|Building Elevator
136|Oruç Reis Mah., Tekstilkent İş Merkezi A: 23 Blok No: 44-45, Esenler, İstanbul, Turkey|Elevator|SITEKS SISMANLAR TEKSTIL SAN. VE TIC. A.S.|Building Elevator
137|Fevzi Çakmak Mah., Büsan 4. Org. San. Böl., 10659 Sk., No: 3/A, Konya, Turkey|Elevator|ISKAY CELIK IC VE DIS TICARET EMLAK LTD. STI.|Building Elevator
138|Hürriyet Mah., Erler Sok., No:16/A, Kartal, İstanbul, Türkiye|Elevator|METROPLAST ASANSOR MALZ. IMA. LTD. STI.|Building Elevator
139|Musalla Bağları Mah., Babür Sok., No: 1/A, Selçuklu, Konya, Turkey|Elevator|HEDA VINC NAK. METAL INS. MAD. SAN. TIC. LTD. STI.|Building Elevator
140|E-5 Yanyol Cad., No:180, Kaynarca, Pendik, İstanbul, Turkey|Elevator|VEFA PREFABRIKE YAPI. SAN. TIC. A.S.|Building Elevator
141|Adana Hacı Sabancı Organize Sanayi Bölgesi, Celal Bayar Bulvarı, No: 31, Sarıçam, Adana, Turkey|Elevator|ARTEK INSAAT TAAHHUT TURIZM TEKSTIL TARIM GIDA SAN. TIC. LTD. STI.|Building Elevator
142|Esenşehir Mah., Nato Yolu Cad., Hidayet Sok., No: 4, Yukarı Dudullu, Ümraniye, İstanbul, Turkey|Elevator|AYDOGDULAR MAKINA TESISAT VE BORU EKLEME PARCALARI SAN. VE TIC. LTD. STI.|Building Elevator
143|Üçgen Mahallesi  Güllük Caddesi, Savaş Apt. No:82, Muratpaşa, Antalya, Turkey|Elevator|TURKISH TRADE CONSULTANT AND ANALYSIS COMPANY|Building Elevator
144|M. Kemal Paşa Mah., Hilal Sk., No: 66/B, Avcılar, İstanbul, Türkiye|Elevator|ASPAC AMBALAJ INS. VE DIS TIC. LTD. STI.|Building Elevator
145|Geçit Mah., Gökova Sok., No: 67/A, Osmangazi, Bursa, Turkey|Elevator|SUNTEK MEKANIK INSAAT INSAAT MALZEMELERI ELEKTRIK MUHENDISLIK GIDA TEKSTIL SAN. VE TIC. LTD. STI.|Building Elevator
146|Sanayi Mah., 60307 Sk., No: 10, Şehitkamil, Gaziantep, Turkey|Elevator|ERBALCI ZIMPARA INSAAT MALZEMELERI SAN. TIC. LTD. STI.|Building Elevator
147|Mevlana Mah., Kıbrıs Cad., No: 23/A, Ataşehir, İstanbul, Türkiye|Elevator|KANYON INTERNATIONAL TRADE LTD. STI.|Building Elevator
148|Elazığ Karayolu Organize Sanayi Bölgesi, 17. Cadde, No:8, Diyarbakır, Turkey|Elevator|KARAVIL DIS TICARET A.S |Building Elevator
149|"Başkent OSB, Recep Tayyip Erdoğan Bulvarı, No: 8, 
Malıköy, Temelli, Ankara, Turkey"|Elevator|MERIH ASANSOR SAN. VE TIC. A.S.|Building Elevator
150|Eskibüyükdere Cad., Güvercin Sk., No: 3 34415, 4. Levent, Kağıthane, İstanbul, Turkey|Elevator|ASAS OTOMOTIV INS. SAN. VE TIC .A.S.|Building Lifts Elevator
151|Organize Sanayi Bölgesi Avrupa Hun Bulvarı No:8 06935 Sincan - Ankara, Turkey|Elevator|FIRAT PLASTIK KAUCUK SAN. VE TIC. A.S.|Building Lifts Elevator
152|Hançerli Mh., 100. Yıl Bulvarı, No: 37, İlkadim, Samsun, Turkey|Elevator|OZER TEKNIK ISI VE TESISAT TIC. LTD. STI.|Building Lifts Elevator
153|Organize San. Böl., 41. Cadde, No: 1, Melikgazi, Kayseri, Turkey|Elevator|FLY BOYA YAPI KIMYASALLARI INSAAT SAN. VE TIC. A.S.|Building Lifts Elevator
154|Hançerli Mh., 100. Yıl Bulvarı, No: 37, İlkadim, Samsun, Turkey|Elevator|IFYIL STOVE|Building Lifts Elevator
155|Fevzi Çakmak Mah., Ayyıldız Cad., No: 69, Karatay, Konya, Turkey|Elevator|SUMAK METAL DEGIRMEN MAKINELERI PETROL OTOMOTIV INSAAT SAN. VE TIC. LTD. STI.|Building Lifts Elevator
156|19 Mayıs Mah. Sinan Ercan Cad. Paşa Korusu Sit. No: 18 B1 Blok 34736 Kadıköy-İstanbul, Turkey|Elevator|UTA DIS TICARET LTD. STI.|Building Lifts Elevator
157|Ramazanoğlu Mah., Kaynarca Cad., Gürsu Sk., No:6, Pendik, İstanbul, Turkey|Elevator|RMT ASANSOR SAN. TIC. LTD. STI.|Building Lifts Elevator
158|Soğanlı Mah., Osmangazi Cad., No: 13, Osmangazi, Bursa, Turkey|Elevator|ESGINLER OTELCILIK INSAAT TEKSTIL TURIZM GIDA SAN. TIC. A.S.|Building Lifts Elevator
159|Sahipata Mah., Mimar Muzaffer Cad., Alaaddin İş Hanı, No: 11/218, Meram, Konya, Turkey|Elevator|INCIR ENERJI SANAYI VE TICARET LTD. STI.|Building Lifts Elevator
160|Kuzguncuk Mah., Gümüşyolu Cad., Rasimağa Sok., No: 11/1, Nakkaştepe, Üsküdar, İstanbul, Türkiye|Elevator|SINTEZ KIMYA|Building Lifts Elevator
161|Maltepe Mah., Dokumacılar Sitesi Sk., Hacıbey İş Hanı, No: 8/2, Zeytinburnu, İstanbul, Türkiye|Elevator|SAY STEEL INOX CONSTRUCTION PRODUCTS|Building Lifts Elevator
162|Saraylar Mah., Hastahane Cad., No: 4, Fehmi Cillov İşhanı Kat: 2 No: 204, Merkezefendi, Denizli, Turkey|Elevator|DIAMON TEKNIK HIZMETLER VE TICARET LTD. STI.|Building Lifts Elevator
163|2. Organize San. Bölgesi, 2. Cadde, No:12 /22, Malatya, Turkey|Elevator|ASAM DIS TICARET LTD. STI.|Building Lifts Elevator
164|İMES San. Sit., E Blok 504. Sk., No:23, 34776 Dudullu, Ümraniye, İstanbul, Turkey|Elevator|IDA ISTANBUL LIFT ASANSOR SAN. TIC. LTD. STI.|Building Lifts Elevator
165|Beşköprü Mah., D-100 Karayolu Cad., No: 130, Serdivan, Sakarya, Turkey|Elevator|EUROPROM OTOMOTIV DIS TICARET IMALAT SAN. VE LTD. STI.|Building Lifts Elevator
166|Oruç Reis Mah., Tekstilkent İş Merkezi A: 23 Blok No: 44-45, Esenler, İstanbul, Turkey|Elevator|SITEKS SISMANLAR TEKSTIL SAN. VE TIC. A.S.|Building Lifts Elevator
167|Fevzi Çakmak Mah., Büsan 4. Org. San. Böl., 10659 Sk., No: 3/A, Konya, Turkey|Elevator|ISKAY CELIK IC VE DIS TICARET EMLAK LTD. STI.|Building Lifts Elevator
168|Esenşehir Mah., Nato Yolu Cad., Hidayet Sok., No: 4, Yukarı Dudullu, Ümraniye, İstanbul, Turkey|Elevator|AYDOGDULAR MAKINA TESISAT VE BORU EKLEME PARCALARI SAN. VE TIC. LTD. STI.|Building Lifts Elevator
169|Adana Hacı Sabancı Organize Sanayi Bölgesi, Celal Bayar Bulvarı, No: 31, Sarıçam, Adana, Turkey|Elevator|ARTEK INSAAT TAAHHUT TURIZM TEKSTIL TARIM GIDA SAN. TIC. LTD. STI.|Building Lifts Elevator
170|M. Kemal Paşa Mah., Hilal Sk., No: 66/B, Avcılar, İstanbul, Türkiye|Elevator|ASPAC AMBALAJ INS. VE DIS TIC. LTD. STI.|Building Lifts Elevator
171|Üçgen Mahallesi  Güllük Caddesi, Savaş Apt. No:82, Muratpaşa, Antalya, Turkey|Elevator|TURKISH TRADE CONSULTANT AND ANALYSIS COMPANY|Building Lifts Elevator
172|Musalla Bağları Mah., Babür Sok., No: 1/A, Selçuklu, Konya, Turkey|Elevator|HEDA VINC NAK. METAL INS. MAD. SAN. TIC. LTD. STI.|Building Lifts Elevator
173|Hürriyet Mah., Erler Sok., No:16/A, Kartal, İstanbul, Türkiye|Elevator|METROPLAST ASANSOR MALZ. IMA. LTD. STI.|Building Lifts Elevator
174|E-5 Yanyol Cad., No:180, Kaynarca, Pendik, İstanbul, Turkey|Elevator|VEFA PREFABRIKE YAPI. SAN. TIC. A.S.|Building Lifts Elevator
175|Geçit Mah., Gökova Sok., No: 67/A, Osmangazi, Bursa, Turkey|Elevator|SUNTEK MEKANIK INSAAT INSAAT MALZEMELERI ELEKTRIK MUHENDISLIK GIDA TEKSTIL SAN. VE TIC. LTD. STI.|Building Lifts Elevator
